      "[I 2024-10-29 09:24:07,510] Trial 112 finished with values: [0.23479291796684265, 0.9370519518852234] and parameters: {'epochs': 43, 'units': 165, 'n_hidden_layers': 5, 'batch_norm': True, 'drop_out': True, 'regularize': False, 'initializers': True, 'drop_out_rate': 0.7169667156926073, 'learning_rate': 0.001856567031486851, 'optimizer': 'RMSprop'}.\n",
      "[I 2024-10-29 09:24:07,668] Trial 111 finished with values: [0.22134356200695038, 0.9500448107719421] and parameters: {'epochs': 43, 'units': 165, 'n_hidden_layers': 5, 'batch_norm': True, 'drop_out': True, 'regularize': False, 'initializers': True, 'drop_out_rate': 0.010934359789832353, 'learning_rate': 0.0030007608958390226, 'optimizer': 'RMSprop'}.\n",
      "[I 2024-10-29 09:24:09,614] Trial 109 finished with values: [0.24000611901283264, 0.9455645084381104] and parameters: {'epochs': 43, 'units': 165, 'n_hidden_layers': 5, 'batch_norm': True, 'drop_out': True, 'regularize': False, 'initializers': True, 'drop_out_rate': 0.012289005622056471, 'learning_rate': 0.001383711158032511, 'optimizer': 'RMSprop'}.\n",
      "[I 2024-10-29 09:24:17,094] Trial 110 finished with values: [0.25841307640075684, 0.9439964294433594] and parameters: {'epochs': 43, 'units': 165, 'n_hidden_layers': 5, 'batch_norm': True, 'drop_out': True, 'regularize': False, 'initializers': True, 'drop_out_rate': 0.00047926690732402744, 'learning_rate': 0.002012667304754319, 'optimizer': 'RMSprop'}.\n",
      "[I 2024-10-29 09:26:28,645] Trial 115 finished with values: [0.2736951410770416, 0.9426523447036743] and parameters: {'epochs': 41, 'units': 165, 'n_hidden_layers': 3, 'batch_norm': True, 'drop_out': True, 'regularize': False, 'initializers': True, 'drop_out_rate': 0.002955760093245295, 'learning_rate': 0.04490869077445771, 'optimizer': 'RMSprop'}.\n",
      "[I 2024-10-29 09:26:33,849] Trial 116 finished with values: [0.259060263633728, 0.9487007260322571] and parameters: {'epochs': 41, 'units': 115, 'n_hidden_layers': 3, 'batch_norm': True, 'drop_out': True, 'regularize': False, 'initializers': True, 'drop_out_rate': 0.012823664751175735, 'learning_rate': 0.037270706738955925, 'optimizer': 'RMSprop'}.\n",
      "[I 2024-10-29 09:26:43,454] Trial 114 finished with values: [0.2060258388519287, 0.9491487741470337] and parameters: {'epochs': 41, 'units': 165, 'n_hidden_layers': 5, 'batch_norm': True, 'drop_out': True, 'regularize': False, 'initializers': True, 'drop_out_rate': 0.008990309205859942, 'learning_rate': 0.02536752449458569, 'optimizer': 'RMSprop'}.\n",
      "[I 2024-10-29 09:26:46,566] Trial 113 finished with values: [0.19234472513198853, 0.9516128897666931] and parameters: {'epochs': 43, 'units': 165, 'n_hidden_layers': 5, 'batch_norm': True, 'drop_out': True, 'regularize': False, 'initializers': True, 'drop_out_rate': 0.004956806839441254, 'learning_rate': 0.08735685755686073, 'optimizer': 'RMSprop'}.\n",
      "[I 2024-10-29 09:29:03,684] Trial 118 finished with values: [0.19643311202526093, 0.9513888955116272] and parameters: {'epochs': 41, 'units': 145, 'n_hidden_layers': 5, 'batch_norm': True, 'drop_out': True, 'regularize': False, 'initializers': True, 'drop_out_rate': 0.07287851940137938, 'learning_rate': 0.000293305065501244, 'optimizer': 'RMSprop'}.\n",
      "[I 2024-10-29 09:29:06,778] Trial 117 finished with values: [0.24088899791240692, 0.9451164603233337] and parameters: {'epochs': 41, 'units': 145, 'n_hidden_layers': 5, 'batch_norm': True, 'drop_out': True, 'regularize': False, 'initializers': True, 'drop_out_rate': 0.018996224684933782, 'learning_rate': 0.00028425747357019304, 'optimizer': 'RMSprop'}.\n",
      "[I 2024-10-29 09:29:20,008] Trial 119 finished with values: [0.23507320880889893, 0.9370519518852234] and parameters: {'epochs': 41, 'units': 105, 'n_hidden_layers': 5, 'batch_norm': True, 'drop_out': True, 'regularize': False, 'initializers': True, 'drop_out_rate': 0.7778787455817423, 'learning_rate': 0.0003219776957185143, 'optimizer': 'RMSprop'}.\n",
      "[I 2024-10-29 09:29:26,801] Trial 120 finished with values: [0.23513519763946533, 0.9370519518852234] and parameters: {'epochs': 41, 'units': 155, 'n_hidden_layers': 5, 'batch_norm': True, 'drop_out': True, 'regularize': False, 'initializers': True, 'drop_out_rate': 0.7923127083039361, 'learning_rate': 0.0003033369620677105, 'optimizer': 'RMSprop'}.\n",
      "[I 2024-10-29 09:31:50,477] Trial 123 finished with values: [0.2402030974626541, 0.9498208165168762] and parameters: {'epochs': 44, 'units': 155, 'n_hidden_layers': 4, 'batch_norm': True, 'drop_out': True, 'regularize': False, 'initializers': True, 'drop_out_rate': 0.06648749772211116, 'learning_rate': 0.0072858303155981016, 'optimizer': 'RMSprop'}.\n",
      "[I 2024-10-29 09:31:54,969] Trial 122 finished with values: [0.20168878138065338, 0.9513888955116272] and parameters: {'epochs': 44, 'units': 155, 'n_hidden_layers': 5, 'batch_norm': True, 'drop_out': True, 'regularize': False, 'initializers': True, 'drop_out_rate': 0.06815528766611886, 'learning_rate': 0.0002939134649292641, 'optimizer': 'RMSprop'}.\n",
      "[I 2024-10-29 09:31:57,880] Trial 124 finished with values: [0.2046857327222824, 0.9518369436264038] and parameters: {'epochs': 44, 'units': 125, 'n_hidden_layers': 4, 'batch_norm': True, 'drop_out': True, 'regularize': False, 'initializers': True, 'drop_out_rate': 0.06072604245746961, 'learning_rate': 0.00014250856880299945, 'optimizer': 'RMSprop'}.\n",
      "[I 2024-10-29 09:32:01,026] Trial 121 finished with values: [0.1902029812335968, 0.9500448107719421] and parameters: {'epochs': 44, 'units': 155, 'n_hidden_layers': 5, 'batch_norm': True, 'drop_out': True, 'regularize': False, 'initializers': True, 'drop_out_rate': 0.09212384952788422, 'learning_rate': 0.0002398904266422607, 'optimizer': 'RMSprop'}.\n",
      "[I 2024-10-29 09:34:04,186] Trial 126 finished with values: [0.24963712692260742, 0.9507168531417847] and parameters: {'epochs': 43, 'units': 100, 'n_hidden_layers': 3, 'batch_norm': True, 'drop_out': True, 'regularize': False, 'initializers': True, 'drop_out_rate': 0.07119041337463117, 'learning_rate': 0.00043273787510524986, 'optimizer': 'RMSprop'}.\n",
      "[I 2024-10-29 09:34:09,337] Trial 125 finished with values: [0.24731916189193726, 0.9491487741470337] and parameters: {'epochs': 44, 'units': 125, 'n_hidden_layers': 3, 'batch_norm': True, 'drop_out': True, 'regularize': False, 'initializers': True, 'drop_out_rate': 0.07039323283443004, 'learning_rate': 0.09654202193477694, 'optimizer': 'RMSprop'}.\n",
      "[I 2024-10-29 09:34:27,544] Trial 128 finished with values: [0.19754721224308014, 0.9491487741470337] and parameters: {'epochs': 44, 'units': 135, 'n_hidden_layers': 4, 'batch_norm': True, 'drop_out': True, 'regularize': False, 'initializers': True, 'drop_out_rate': 0.0732173668543266, 'learning_rate': 0.0004277640390477972, 'optimizer': 'RMSprop'}.\n",
      "[I 2024-10-29 09:34:34,204] Trial 127 finished with values: [0.23104262351989746, 0.9502688050270081] and parameters: {'epochs': 43, 'units': 135, 'n_hidden_layers': 3, 'batch_norm': True, 'drop_out': True, 'regularize': False, 'initializers': True, 'drop_out_rate': 0.06564738628585258, 'learning_rate': 0.0001498338704343077, 'optimizer': 'RMSprop'}.\n",
      "[I 2024-10-29 09:36:21,053] Trial 131 finished with values: [0.22349819540977478, 0.9471325874328613] and parameters: {'epochs': 34, 'units': 105, 'n_hidden_layers': 4, 'batch_norm': True, 'drop_out': True, 'regularize': False, 'initializers': True, 'drop_out_rate': 0.08577292167909115, 'learning_rate': 0.0002366043937184897, 'optimizer': 'RMSprop'}.\n",
      "[I 2024-10-29 09:36:33,988] Trial 130 finished with values: [0.24444030225276947, 0.9504928588867188] and parameters: {'epochs': 44, 'units': 115, 'n_hidden_layers': 4, 'batch_norm': True, 'drop_out': True, 'regularize': False, 'initializers': True, 'drop_out_rate': 0.055731553318432506, 'learning_rate': 0.0001480440246922734, 'optimizer': 'RMSprop'}.\n",
      "[I 2024-10-29 09:36:44,426] Trial 129 finished with values: [0.19206677377223969, 0.9520609378814697] and parameters: {'epochs': 44, 'units': 135, 'n_hidden_layers': 4, 'batch_norm': True, 'drop_out': True, 'regularize': False, 'initializers': True, 'drop_out_rate': 0.08790233143600894, 'learning_rate': 0.00023441188991834186, 'optimizer': 'RMSprop'}.\n",
      "[I 2024-10-29 09:36:53,376] Trial 132 finished with values: [0.19405797123908997, 0.9493727684020996] and parameters: {'epochs': 40, 'units': 135, 'n_hidden_layers': 4, 'batch_norm': True, 'drop_out': True, 'regularize': False, 'initializers': True, 'drop_out_rate': 0.04413988547829003, 'learning_rate': 7.640205713512721e-05, 'optimizer': 'RMSprop'}.\n",
      "[I 2024-10-29 09:38:18,755] Trial 133 finished with values: [0.26550954580307007, 0.9491487741470337] and parameters: {'epochs': 40, 'units': 115, 'n_hidden_layers': 2, 'batch_norm': True, 'drop_out': True, 'regularize': False, 'initializers': True, 'drop_out_rate': 0.04920727896417285, 'learning_rate': 7.778095268835052e-05, 'optimizer': 'RMSprop'}.\n",
      "[I 2024-10-29 09:38:35,518] Trial 134 finished with values: [0.29142412543296814, 0.9453405141830444] and parameters: {'epochs': 42, 'units': 135, 'n_hidden_layers': 2, 'batch_norm': True, 'drop_out': True, 'regularize': False, 'initializers': True, 'drop_out_rate': 0.023171407355554396, 'learning_rate': 8.167362822331857e-05, 'optimizer': 'RMSprop'}.\n",
      "[I 2024-10-29 09:38:48,119] Trial 135 finished with values: [0.2777622938156128, 0.9480286836624146] and parameters: {'epochs': 40, 'units': 155, 'n_hidden_layers': 2, 'batch_norm': True, 'drop_out': True, 'regularize': False, 'initializers': True, 'drop_out_rate': 0.02757155330753409, 'learning_rate': 8.679330775967329e-05, 'optimizer': 'RMSprop'}.\n",
      "[I 2024-10-29 09:38:53,211] Trial 136 finished with values: [0.22165092825889587, 0.9518369436264038] and parameters: {'epochs': 40, 'units': 145, 'n_hidden_layers': 2, 'batch_norm': True, 'drop_out': True, 'regularize': False, 'initializers': True, 'drop_out_rate': 0.22793779627711863, 'learning_rate': 8.665923163596792e-05, 'optimizer': 'RMSprop'}.\n",
      "[I 2024-10-29 09:40:58,400] Trial 137 finished with values: [0.20178262889385223, 0.9518369436264038] and parameters: {'epochs': 44, 'units': 125, 'n_hidden_layers': 5, 'batch_norm': True, 'drop_out': True, 'regularize': False, 'initializers': True, 'drop_out_rate': 0.0282304077955392, 'learning_rate': 0.00023153175829722798, 'optimizer': 'RMSprop'}.\n",
      "[I 2024-10-29 09:41:20,505] Trial 138 finished with values: [0.18908263742923737, 0.9493727684020996] and parameters: {'epochs': 45, 'units': 145, 'n_hidden_layers': 5, 'batch_norm': True, 'drop_out': True, 'regularize': False, 'initializers': True, 'drop_out_rate': 0.14673243133144934, 'learning_rate': 0.0002495529958589845, 'optimizer': 'RMSprop'}.\n",
      "[I 2024-10-29 09:41:36,655] Trial 140 finished with values: [0.2340424507856369, 0.9370519518852234] and parameters: {'epochs': 44, 'units': 145, 'n_hidden_layers': 5, 'batch_norm': True, 'drop_out': True, 'regularize': True, 'initializers': True, 'drop_out_rate': 0.7276860655341979, 'learning_rate': 0.0002272385590317841, 'optimizer': 'RMSprop'}.\n",
      "[I 2024-10-29 09:41:45,692] Trial 139 finished with values: [0.19029882550239563, 0.9520609378814697] and parameters: {'epochs': 45, 'units': 165, 'n_hidden_layers': 5, 'batch_norm': True, 'drop_out': True, 'regularize': True, 'initializers': True, 'drop_out_rate': 0.0489406679736546, 'learning_rate': 0.00022384287887676257, 'optimizer': 'RMSprop'}.\n",
      "[I 2024-10-29 09:43:19,432] Trial 141 finished with values: [0.20444048941135406, 0.9480286836624146] and parameters: {'epochs': 43, 'units': 145, 'n_hidden_layers': 5, 'batch_norm': True, 'drop_out': True, 'regularize': True, 'initializers': True, 'drop_out_rate': 0.048133458420141065, 'learning_rate': 0.00021937466682364065, 'optimizer': 'RMSprop'}.\n",
      "[I 2024-10-29 09:44:08,191] Trial 144 finished with values: [0.19855187833309174, 0.9495967626571655] and parameters: {'epochs': 43, 'units': 125, 'n_hidden_layers': 4, 'batch_norm': True, 'drop_out': True, 'regularize': False, 'initializers': True, 'drop_out_rate': 0.08437997491939668, 'learning_rate': 0.0004202750898312107, 'optimizer': 'RMSprop'}.\n",
      "[I 2024-10-29 09:44:18,727] Trial 142 finished with values: [0.2347290962934494, 0.9370519518852234] and parameters: {'epochs': 43, 'units': 125, 'n_hidden_layers': 5, 'batch_norm': True, 'drop_out': True, 'regularize': True, 'initializers': True, 'drop_out_rate': 0.724012378659197, 'learning_rate': 0.0002169813495818362, 'optimizer': 'RMSprop'}.\n",
      "[I 2024-10-29 09:44:24,175] Trial 143 finished with values: [0.2083428055047989, 0.9511649012565613] and parameters: {'epochs': 43, 'units': 125, 'n_hidden_layers': 4, 'batch_norm': True, 'drop_out': True, 'regularize': True, 'initializers': True, 'drop_out_rate': 0.05066896188233478, 'learning_rate': 0.0004033579919809233, 'optimizer': 'RMSprop'}.\n",
      "[I 2024-10-29 09:45:46,482] Trial 145 finished with values: [0.2076840102672577, 0.9520609378814697] and parameters: {'epochs': 43, 'units': 125, 'n_hidden_layers': 4, 'batch_norm': True, 'drop_out': True, 'regularize': False, 'initializers': True, 'drop_out_rate': 0.07687953038298981, 'learning_rate': 0.0004191377756827905, 'optimizer': 'RMSprop'}.\n",
      "[I 2024-10-29 09:46:24,023] Trial 147 finished with values: [0.24787987768650055, 0.9513888955116272] and parameters: {'epochs': 42, 'units': 165, 'n_hidden_layers': 3, 'batch_norm': True, 'drop_out': True, 'regularize': False, 'initializers': True, 'drop_out_rate': 0.03963297660584234, 'learning_rate': 0.00012988465299369184, 'optimizer': 'RMSprop'}.\n",
      "[I 2024-10-29 09:46:44,524] Trial 146 finished with values: [0.2348531037569046, 0.9370519518852234] and parameters: {'epochs': 42, 'units': 165, 'n_hidden_layers': 5, 'batch_norm': True, 'drop_out': True, 'regularize': False, 'initializers': True, 'drop_out_rate': 0.7562666702268005, 'learning_rate': 0.00013774990734666484, 'optimizer': 'RMSprop'}.\n",
      "[I 2024-10-29 09:46:45,670] Trial 148 finished with values: [0.27188965678215027, 0.9451164603233337] and parameters: {'epochs': 42, 'units': 165, 'n_hidden_layers': 3, 'batch_norm': True, 'drop_out': True, 'regularize': False, 'initializers': True, 'drop_out_rate': 0.02840087026069149, 'learning_rate': 0.00013723885801035312, 'optimizer': 'RMSprop'}.\n",
      "[I 2024-10-29 09:48:10,517] Trial 149 finished with values: [0.2804357409477234, 0.9475806355476379] and parameters: {'epochs': 42, 'units': 165, 'n_hidden_layers': 3, 'batch_norm': True, 'drop_out': True, 'regularize': False, 'initializers': True, 'drop_out_rate': 0.0339885082813515, 'learning_rate': 0.009838637057519337, 'optimizer': 'Adam'}.\n",
      "[I 2024-10-29 09:48:47,384] Trial 150 finished with values: [0.20051930844783783, 0.9522849321365356] and parameters: {'epochs': 42, 'units': 105, 'n_hidden_layers': 3, 'batch_norm': True, 'drop_out': True, 'regularize': False, 'initializers': True, 'drop_out_rate': 0.22946100644965917, 'learning_rate': 0.011578628009153876, 'optimizer': 'Adam'}.\n",
      "[I 2024-10-29 09:48:59,903] Trial 152 finished with values: [0.20166794955730438, 0.9518369436264038] and parameters: {'epochs': 35, 'units': 160, 'n_hidden_layers': 4, 'batch_norm': True, 'drop_out': True, 'regularize': False, 'initializers': True, 'drop_out_rate': 0.08730983698715514, 'learning_rate': 0.01052183782172973, 'optimizer': 'Adam'}.\n",
      "[I 2024-10-29 09:49:42,570] Trial 151 finished with values: [0.21246007084846497, 0.9370519518852234] and parameters: {'epochs': 44, 'units': 160, 'n_hidden_layers': 4, 'batch_norm': True, 'drop_out': True, 'regularize': False, 'initializers': True, 'drop_out_rate': 0.608802160494021, 'learning_rate': 0.014205052338930817, 'optimizer': 'Adam'}.\n",
      "[I 2024-10-29 09:50:50,015] Trial 154 finished with values: [0.1835760921239853, 0.9469085931777954] and parameters: {'epochs': 34, 'units': 105, 'n_hidden_layers': 4, 'batch_norm': True, 'drop_out': True, 'regularize': False, 'initializers': True, 'drop_out_rate': 0.2330621367068651, 'learning_rate': 0.010043548284612075, 'optimizer': 'Adam'}.\n",
      "[I 2024-10-29 09:51:05,493] Trial 153 finished with values: [0.19904504716396332, 0.9538530707359314] and parameters: {'epochs': 44, 'units': 105, 'n_hidden_layers': 4, 'batch_norm': True, 'drop_out': True, 'regularize': False, 'initializers': True, 'drop_out_rate': 0.09403147989618182, 'learning_rate': 0.005532408528428981, 'optimizer': 'Adam'}.\n",
      "[I 2024-10-29 09:51:16,025] Trial 155 finished with values: [0.23681052029132843, 0.9509408473968506] and parameters: {'epochs': 35, 'units': 160, 'n_hidden_layers': 4, 'batch_norm': True, 'drop_out': True, 'regularize': False, 'initializers': True, 'drop_out_rate': 0.09267119332190304, 'learning_rate': 4.709663176554432e-05, 'optimizer': 'Adam'}.\n",
      "[I 2024-10-29 09:51:24,958] Trial 156 finished with values: [0.3491302728652954, 0.9392921328544617] and parameters: {'epochs': 35, 'units': 160, 'n_hidden_layers': 5, 'batch_norm': False, 'drop_out': False, 'regularize': True, 'initializers': True, 'drop_out_rate': 0.09441348949582468, 'learning_rate': 0.004287884341388741, 'optimizer': 'RMSprop'}.\n",
      "[I 2024-10-29 09:52:52,446] Trial 157 finished with values: [0.8751195073127747, 0.9339157938957214] and parameters: {'epochs': 43, 'units': 170, 'n_hidden_layers': 5, 'batch_norm': False, 'drop_out': False, 'regularize': True, 'initializers': True, 'drop_out_rate': 0.09303821587533304, 'learning_rate': 6.08245494026589e-05, 'optimizer': 'Adam'}.\n",
      "[I 2024-10-29 09:53:50,652] Trial 159 finished with values: [0.22463184595108032, 0.9370519518852234] and parameters: {'epochs': 45, 'units': 100, 'n_hidden_layers': 4, 'batch_norm': True, 'drop_out': True, 'regularize': False, 'initializers': True, 'drop_out_rate': 0.15005436237336112, 'learning_rate': 4.7306327317026386e-05, 'optimizer': 'Adam'}.\n",
      "[I 2024-10-29 09:53:56,412] Trial 160 finished with values: [0.23784363269805908, 0.9507168531417847] and parameters: {'epochs': 43, 'units': 105, 'n_hidden_layers': 4, 'batch_norm': True, 'drop_out': True, 'regularize': False, 'initializers': True, 'drop_out_rate': 0.04456561511033785, 'learning_rate': 5.33660782798735e-05, 'optimizer': 'Adam'}.\n",
      "[I 2024-10-29 09:54:09,513] Trial 158 finished with values: [0.21009257435798645, 0.9502688050270081] and parameters: {'epochs': 43, 'units': 105, 'n_hidden_layers': 4, 'batch_norm': True, 'drop_out': True, 'regularize': False, 'initializers': True, 'drop_out_rate': 0.09569555026020743, 'learning_rate': 5.006390339127013e-05, 'optimizer': 'Adam'}.\n",
      "[I 2024-10-29 09:55:39,601] Trial 161 finished with values: [0.2082545906305313, 0.9370519518852234] and parameters: {'epochs': 45, 'units': 100, 'n_hidden_layers': 4, 'batch_norm': True, 'drop_out': True, 'regularize': False, 'initializers': True, 'drop_out_rate': 0.3306382421521977, 'learning_rate': 0.0010500672032458364, 'optimizer': 'Adam'}.\n",
      "[I 2024-10-29 09:56:07,579] Trial 163 finished with values: [0.23330174386501312, 0.9451164603233337] and parameters: {'epochs': 34, 'units': 105, 'n_hidden_layers': 5, 'batch_norm': True, 'drop_out': True, 'regularize': False, 'initializers': True, 'drop_out_rate': 0.022469238359684375, 'learning_rate': 0.0011120685296059142, 'optimizer': 'Adam'}.\n",
      "[I 2024-10-29 09:56:32,546] Trial 162 finished with values: [0.18487820029258728, 0.9487007260322571] and parameters: {'epochs': 43, 'units': 105, 'n_hidden_layers': 4, 'batch_norm': True, 'drop_out': True, 'regularize': False, 'initializers': True, 'drop_out_rate': 0.3347887545822438, 'learning_rate': 0.016630065369158262, 'optimizer': 'Adam'}.\n",
      "[I 2024-10-29 09:57:04,113] Trial 164 finished with values: [0.1815885305404663, 0.9480286836624146] and parameters: {'epochs': 45, 'units': 105, 'n_hidden_layers': 4, 'batch_norm': True, 'drop_out': True, 'regularize': False, 'initializers': True, 'drop_out_rate': 0.3371217775820984, 'learning_rate': 0.0013552998749157572, 'optimizer': 'Adam'}.\n",
      "[I 2024-10-29 09:58:20,862] Trial 165 finished with values: [0.19077755510807037, 0.9511649012565613] and parameters: {'epochs': 44, 'units': 100, 'n_hidden_layers': 4, 'batch_norm': True, 'drop_out': True, 'regularize': False, 'initializers': True, 'drop_out_rate': 0.13217240112395262, 'learning_rate': 0.017146412196160435, 'optimizer': 'Adam'}.\n",
      "[I 2024-10-29 09:58:50,047] Trial 166 finished with values: [0.2004423886537552, 0.9513888955116272] and parameters: {'epochs': 44, 'units': 105, 'n_hidden_layers': 4, 'batch_norm': True, 'drop_out': True, 'regularize': False, 'initializers': True, 'drop_out_rate': 0.13208736151297712, 'learning_rate': 0.019120723136335952, 'optimizer': 'Adam'}.\n",
      "[I 2024-10-29 09:58:56,522] Trial 167 finished with values: [0.2501046657562256, 0.9516128897666931] and parameters: {'epochs': 43, 'units': 170, 'n_hidden_layers': 2, 'batch_norm': True, 'drop_out': True, 'regularize': False, 'initializers': True, 'drop_out_rate': 0.18222918346549594, 'learning_rate': 0.09653815053102834, 'optimizer': 'RMSprop'}.\n",
      "[I 2024-10-29 09:59:38,845] Trial 168 finished with values: [0.1811608076095581, 0.9529569745063782] and parameters: {'epochs': 44, 'units': 105, 'n_hidden_layers': 4, 'batch_norm': True, 'drop_out': True, 'regularize': False, 'initializers': True, 'drop_out_rate': 0.13091217120534437, 'learning_rate': 0.0029843062837564146, 'optimizer': 'Adam'}.\n",
