{
 "cells": [
  {
   "cell_type": "code",
   "execution_count": 1,
   "id": "a413891c",
   "metadata": {
    "execution": {
     "iopub.execute_input": "2024-10-29T09:20:32.522188Z",
     "iopub.status.busy": "2024-10-29T09:20:32.521798Z",
     "iopub.status.idle": "2024-10-29T09:20:32.533139Z",
     "shell.execute_reply": "2024-10-29T09:20:32.531919Z"
    },
    "papermill": {
     "duration": 0.034459,
     "end_time": "2024-10-29T09:20:32.535144",
     "exception": false,
     "start_time": "2024-10-29T09:20:32.500685",
     "status": "completed"
    },
    "tags": []
   },
   "outputs": [
    {
     "name": "stdout",
     "output_type": "stream",
     "text": [
      "importing the neccessary libraries with output captured\n"
     ]
    }
   ],
   "source": [
    "print('importing the neccessary libraries with output captured')"
   ]
  },
  {
   "cell_type": "code",
   "execution_count": 2,
   "id": "fbb24e50",
   "metadata": {
    "execution": {
     "iopub.execute_input": "2024-10-29T09:20:32.573199Z",
     "iopub.status.busy": "2024-10-29T09:20:32.572877Z",
     "iopub.status.idle": "2024-10-29T09:21:10.807683Z",
     "shell.execute_reply": "2024-10-29T09:21:10.806672Z"
    },
    "papermill": {
     "duration": 38.256695,
     "end_time": "2024-10-29T09:21:10.810147",
     "exception": false,
     "start_time": "2024-10-29T09:20:32.553452",
     "status": "completed"
    },
    "tags": []
   },
   "outputs": [],
   "source": [
    "%%capture\n",
    "!pip install optuna\n",
    "!pip install imblearn\n",
    "import pandas as pd\n",
    "from sklearn.preprocessing import OrdinalEncoder, OneHotEncoder\n",
    "from sklearn.compose import ColumnTransformer\n",
    "from sklearn.pipeline import Pipeline\n",
    "import matplotlib.pyplot as plt\n",
    "from scipy import stats\n",
    "import numpy as np\n",
    "import seaborn as sns\n",
    "from imblearn.over_sampling import SMOTE, SVMSMOTE\n",
    "from sklearn.model_selection import StratifiedShuffleSplit\n",
    "import tensorflow as tf\n",
    "import pandas as pd\n",
    "from sklearn.preprocessing import StandardScaler, PolynomialFeatures\n",
    "from sklearn.pipeline import Pipeline\n",
    "import os"
   ]
  },
  {
   "cell_type": "code",
   "execution_count": 3,
   "id": "26b2cf00",
   "metadata": {
    "execution": {
     "iopub.execute_input": "2024-10-29T09:21:10.848417Z",
     "iopub.status.busy": "2024-10-29T09:21:10.847785Z",
     "iopub.status.idle": "2024-10-29T09:21:10.852689Z",
     "shell.execute_reply": "2024-10-29T09:21:10.851790Z"
    },
    "papermill": {
     "duration": 0.026478,
     "end_time": "2024-10-29T09:21:10.854650",
     "exception": false,
     "start_time": "2024-10-29T09:21:10.828172",
     "status": "completed"
    },
    "tags": []
   },
   "outputs": [],
   "source": [
    "# import tensorflow as tf\n",
    "\n",
    "# print('Connecting to GPU \\n')\n",
    "# # List GPUs and set memory growth before initializing TensorFlow or Keras models\n",
    "# gpus = tf.config.list_physical_devices('GPU')\n",
    "# if gpus:\n",
    "#     try:\n",
    "#         for gpu in gpus:\n",
    "#             tf.config.experimental.set_memory_growth(gpu, True)\n",
    "#         print(\"Memory growth enabled for GPUs.\")\n",
    "#     except RuntimeError as e:\n",
    "#         print(f\"Error setting memory growth: {e}\")\n",
    "# else:\n",
    "#     print(\"No GPUs found.\")\n",
    "\n",
    "# if gpus:\n",
    "#     strategy = tf.distribute.MirroredStrategy()\n",
    "#     print(\"Mirrored Strategy initialized with GPUs.\")\n",
    "# else:\n",
    "#     strategy = tf.distribute.get_strategy()  # Default strategy if no GPUs available\n",
    "#     print(\"Using Default Strategy.\")"
   ]
  },
  {
   "cell_type": "code",
   "execution_count": 4,
   "id": "cad967b9",
   "metadata": {
    "execution": {
     "iopub.execute_input": "2024-10-29T09:21:10.891159Z",
     "iopub.status.busy": "2024-10-29T09:21:10.890353Z",
     "iopub.status.idle": "2024-10-29T09:21:10.894584Z",
     "shell.execute_reply": "2024-10-29T09:21:10.893831Z"
    },
    "papermill": {
     "duration": 0.02438,
     "end_time": "2024-10-29T09:21:10.896390",
     "exception": false,
     "start_time": "2024-10-29T09:21:10.872010",
     "status": "completed"
    },
    "tags": []
   },
   "outputs": [],
   "source": [
    "# import os\n",
    "# import tensorflow as tf\n",
    "\n",
    "# # Initialize the TPU\n",
    "# resolver = tf.distribute.cluster_resolver.TPUClusterResolver()\n",
    "# tf.config.experimental_connect_to_cluster(resolver)\n",
    "# tf.tpu.experimental.initialize_tpu_system(resolver)\n",
    "# print(\"All TPU devices:\", tf.config.list_logical_devices('TPU'))\n",
    "\n",
    "\n",
    "# # Configure TensorFlow to use the TPU\n",
    "# os.environ['TF_XLA_FLAGS'] = '--tf_xla_enable_xla_devices'\n",
    "# tf.config.optimizer.set_jit(True)"
   ]
  },
  {
   "cell_type": "code",
   "execution_count": 5,
   "id": "a00d8c76",
   "metadata": {
    "execution": {
     "iopub.execute_input": "2024-10-29T09:21:10.932039Z",
     "iopub.status.busy": "2024-10-29T09:21:10.931753Z",
     "iopub.status.idle": "2024-10-29T09:21:10.935421Z",
     "shell.execute_reply": "2024-10-29T09:21:10.934644Z"
    },
    "papermill": {
     "duration": 0.02364,
     "end_time": "2024-10-29T09:21:10.937314",
     "exception": false,
     "start_time": "2024-10-29T09:21:10.913674",
     "status": "completed"
    },
    "tags": []
   },
   "outputs": [],
   "source": [
    "# import tensorflow as tf\n",
    "\n",
    "# # List all physical devices, specifically looking for GPUs\n",
    "# gpus = tf.config.list_physical_devices('GPU')\n",
    "# print(f\"GPUs available: {gpus}\")\n"
   ]
  },
  {
   "cell_type": "code",
   "execution_count": 6,
   "id": "ae01b078",
   "metadata": {
    "execution": {
     "iopub.execute_input": "2024-10-29T09:21:10.973205Z",
     "iopub.status.busy": "2024-10-29T09:21:10.972928Z",
     "iopub.status.idle": "2024-10-29T09:21:10.976804Z",
     "shell.execute_reply": "2024-10-29T09:21:10.976008Z"
    },
    "id": "AGwgatwy4zqh",
    "papermill": {
     "duration": 0.023833,
     "end_time": "2024-10-29T09:21:10.978616",
     "exception": false,
     "start_time": "2024-10-29T09:21:10.954783",
     "status": "completed"
    },
    "tags": []
   },
   "outputs": [],
   "source": [
    "# import os\n",
    "\n",
    "# # Create the directory explicitly with the absolute path\n",
    "# os.makedirs(\"~/.kaggle\", exist_ok=True)\n",
    "\n",
    "# !cp \"/kaggle/input/kaggle-token/kaggle (1).json\" ~/kaggle.json\n",
    "# # Copy the kaggle.json file from your Google Drive to the required location\n",
    "# !cp ~/kaggle.json ~/.kaggle/\n",
    "\n",
    "# # Set the correct permissions for the Kaggle API token\n",
    "# !chmod 600 ~/.kaggle/kaggle.json\n"
   ]
  },
  {
   "cell_type": "code",
   "execution_count": null,
   "id": "800e4ba7",
   "metadata": {
    "papermill": {
     "duration": 0.017132,
     "end_time": "2024-10-29T09:21:11.013081",
     "exception": false,
     "start_time": "2024-10-29T09:21:10.995949",
     "status": "completed"
    },
    "tags": []
   },
   "outputs": [],
   "source": []
  },
  {
   "cell_type": "code",
   "execution_count": 7,
   "id": "9e1bf262",
   "metadata": {
    "execution": {
     "iopub.execute_input": "2024-10-29T09:21:11.048902Z",
     "iopub.status.busy": "2024-10-29T09:21:11.048601Z",
     "iopub.status.idle": "2024-10-29T09:21:11.052111Z",
     "shell.execute_reply": "2024-10-29T09:21:11.051333Z"
    },
    "id": "lnWQ8Xfp5RWI",
    "outputId": "51ac6c76-76f4-4d42-a310-f2987df37d13",
    "papermill": {
     "duration": 0.023547,
     "end_time": "2024-10-29T09:21:11.053964",
     "exception": false,
     "start_time": "2024-10-29T09:21:11.030417",
     "status": "completed"
    },
    "tags": []
   },
   "outputs": [],
   "source": [
    "# !pip install kaggle\n",
    "# !kaggle competitions download -c playground-series-s4e10"
   ]
  },
  {
   "cell_type": "code",
   "execution_count": 8,
   "id": "1e0e132f",
   "metadata": {
    "execution": {
     "iopub.execute_input": "2024-10-29T09:21:11.089633Z",
     "iopub.status.busy": "2024-10-29T09:21:11.089340Z",
     "iopub.status.idle": "2024-10-29T09:21:11.093821Z",
     "shell.execute_reply": "2024-10-29T09:21:11.093131Z"
    },
    "id": "SStBLetO6Lzv",
    "papermill": {
     "duration": 0.024365,
     "end_time": "2024-10-29T09:21:11.095598",
     "exception": false,
     "start_time": "2024-10-29T09:21:11.071233",
     "status": "completed"
    },
    "tags": []
   },
   "outputs": [],
   "source": [
    "# from zipfile import ZipFile\n",
    "\n",
    "# with ZipFile('/content/playground-series-s4e10.zip', 'r') as zip_ref:\n",
    "#     zip_ref.extractall('/content')"
   ]
  },
  {
   "cell_type": "code",
   "execution_count": 9,
   "id": "d4d06da7",
   "metadata": {
    "execution": {
     "iopub.execute_input": "2024-10-29T09:21:11.131816Z",
     "iopub.status.busy": "2024-10-29T09:21:11.131479Z",
     "iopub.status.idle": "2024-10-29T09:21:11.400123Z",
     "shell.execute_reply": "2024-10-29T09:21:11.399147Z"
    },
    "id": "4-aOwIrp2pYI",
    "outputId": "e6ef0214-f215-4ace-94ca-27dcaf0ca8f8",
    "papermill": {
     "duration": 0.289764,
     "end_time": "2024-10-29T09:21:11.402556",
     "exception": false,
     "start_time": "2024-10-29T09:21:11.112792",
     "status": "completed"
    },
    "tags": []
   },
   "outputs": [
    {
     "name": "stdout",
     "output_type": "stream",
     "text": [
      "reading the csv files into pandas dataframes.\n"
     ]
    }
   ],
   "source": [
    "\n",
    "print(f'reading the csv files into pandas dataframes.')\n",
    "\n",
    "try:\n",
    "    train_df = pd.read_csv('/kaggle/input/playground-series-s4e10/train.csv')\n",
    "    test_df = pd.read_csv('/kaggle/input/playground-series-s4e10/test.csv')\n",
    "    sub_df = pd.read_csv('/kaggle/input/playground-series-s4e10/sample_submission.csv')\n",
    "except Exception as e:\n",
    "    print(f'could not load the csv files into pandas dataframes')\n"
   ]
  },
  {
   "cell_type": "code",
   "execution_count": 10,
   "id": "f05672c5",
   "metadata": {
    "execution": {
     "iopub.execute_input": "2024-10-29T09:21:11.439968Z",
     "iopub.status.busy": "2024-10-29T09:21:11.439628Z",
     "iopub.status.idle": "2024-10-29T09:21:11.443745Z",
     "shell.execute_reply": "2024-10-29T09:21:11.442872Z"
    },
    "id": "msVqxn5m2pYI",
    "papermill": {
     "duration": 0.024638,
     "end_time": "2024-10-29T09:21:11.445602",
     "exception": false,
     "start_time": "2024-10-29T09:21:11.420964",
     "status": "completed"
    },
    "tags": []
   },
   "outputs": [],
   "source": [
    "# train_df.info()"
   ]
  },
  {
   "cell_type": "code",
   "execution_count": 11,
   "id": "49337af9",
   "metadata": {
    "execution": {
     "iopub.execute_input": "2024-10-29T09:21:11.481647Z",
     "iopub.status.busy": "2024-10-29T09:21:11.481316Z",
     "iopub.status.idle": "2024-10-29T09:21:11.485183Z",
     "shell.execute_reply": "2024-10-29T09:21:11.484424Z"
    },
    "id": "8CVAOYiU2pYJ",
    "papermill": {
     "duration": 0.024058,
     "end_time": "2024-10-29T09:21:11.487077",
     "exception": false,
     "start_time": "2024-10-29T09:21:11.463019",
     "status": "completed"
    },
    "tags": []
   },
   "outputs": [],
   "source": [
    "# test_df.info()"
   ]
  },
  {
   "cell_type": "code",
   "execution_count": 12,
   "id": "5fdc46c1",
   "metadata": {
    "execution": {
     "iopub.execute_input": "2024-10-29T09:21:11.523008Z",
     "iopub.status.busy": "2024-10-29T09:21:11.522707Z",
     "iopub.status.idle": "2024-10-29T09:21:11.526519Z",
     "shell.execute_reply": "2024-10-29T09:21:11.525683Z"
    },
    "id": "dhU-Nqzs2pYJ",
    "papermill": {
     "duration": 0.023856,
     "end_time": "2024-10-29T09:21:11.528362",
     "exception": false,
     "start_time": "2024-10-29T09:21:11.504506",
     "status": "completed"
    },
    "tags": []
   },
   "outputs": [],
   "source": [
    "# train_df.isnull().any(), test_df.isnull().any()"
   ]
  },
  {
   "cell_type": "code",
   "execution_count": 13,
   "id": "f915858b",
   "metadata": {
    "execution": {
     "iopub.execute_input": "2024-10-29T09:21:11.564183Z",
     "iopub.status.busy": "2024-10-29T09:21:11.563891Z",
     "iopub.status.idle": "2024-10-29T09:21:11.571631Z",
     "shell.execute_reply": "2024-10-29T09:21:11.570868Z"
    },
    "id": "A4GXB1u62pYJ",
    "papermill": {
     "duration": 0.027886,
     "end_time": "2024-10-29T09:21:11.573517",
     "exception": false,
     "start_time": "2024-10-29T09:21:11.545631",
     "status": "completed"
    },
    "tags": []
   },
   "outputs": [],
   "source": [
    "cat_cols = train_df.select_dtypes('object').columns\n",
    "num_cols = []\n",
    "for col in train_df.select_dtypes(exclude='object').columns:\n",
    "    if col not in ('id', 'loan_status'):\n",
    "        num_cols.append(col)\n",
    "# num_cols, cat_cols"
   ]
  },
  {
   "cell_type": "code",
   "execution_count": 14,
   "id": "9b4ae3c8",
   "metadata": {
    "execution": {
     "iopub.execute_input": "2024-10-29T09:21:11.609469Z",
     "iopub.status.busy": "2024-10-29T09:21:11.609148Z",
     "iopub.status.idle": "2024-10-29T09:21:11.612914Z",
     "shell.execute_reply": "2024-10-29T09:21:11.612133Z"
    },
    "id": "8MTuOiD92pYJ",
    "papermill": {
     "duration": 0.023952,
     "end_time": "2024-10-29T09:21:11.614895",
     "exception": false,
     "start_time": "2024-10-29T09:21:11.590943",
     "status": "completed"
    },
    "tags": []
   },
   "outputs": [],
   "source": [
    "# train_df['loan_status'].value_counts(normalize=True)"
   ]
  },
  {
   "cell_type": "code",
   "execution_count": 15,
   "id": "c64a016b",
   "metadata": {
    "execution": {
     "iopub.execute_input": "2024-10-29T09:21:11.650712Z",
     "iopub.status.busy": "2024-10-29T09:21:11.650407Z",
     "iopub.status.idle": "2024-10-29T09:21:11.657090Z",
     "shell.execute_reply": "2024-10-29T09:21:11.656303Z"
    },
    "id": "59Vicvtb2pYJ",
    "papermill": {
     "duration": 0.026779,
     "end_time": "2024-10-29T09:21:11.658945",
     "exception": false,
     "start_time": "2024-10-29T09:21:11.632166",
     "status": "completed"
    },
    "tags": []
   },
   "outputs": [],
   "source": [
    "\n",
    "def box_plots_num_cols(df, columns):\n",
    "    df = df.copy()\n",
    "    base_width = 10\n",
    "    base_height = 5\n",
    "    rows = len(columns)\n",
    "    cols = 1\n",
    "    fig_width = cols * base_width\n",
    "    fig_height = rows * base_height\n",
    "    fig, axes = plt.subplots(rows, cols, figsize=(fig_width, fig_height))\n",
    "    axes = axes.flatten() if rows > 1 else [axes]\n",
    "    for i, col in enumerate(columns):\n",
    "        axes[i].boxplot(df[col])\n",
    "        axes[i].set_title(col)\n",
    "    for j in range(i+1, len(axes)):\n",
    "        axes[j].axis('off')\n",
    "    plt.tight_layout()"
   ]
  },
  {
   "cell_type": "code",
   "execution_count": 16,
   "id": "70e9518c",
   "metadata": {
    "execution": {
     "iopub.execute_input": "2024-10-29T09:21:11.694643Z",
     "iopub.status.busy": "2024-10-29T09:21:11.694329Z",
     "iopub.status.idle": "2024-10-29T09:21:11.698054Z",
     "shell.execute_reply": "2024-10-29T09:21:11.697278Z"
    },
    "id": "5q3wrA282pYK",
    "papermill": {
     "duration": 0.02378,
     "end_time": "2024-10-29T09:21:11.700003",
     "exception": false,
     "start_time": "2024-10-29T09:21:11.676223",
     "status": "completed"
    },
    "tags": []
   },
   "outputs": [],
   "source": [
    "# box_plots_num_cols(train_df, num_cols)"
   ]
  },
  {
   "cell_type": "code",
   "execution_count": 17,
   "id": "27843a8d",
   "metadata": {
    "execution": {
     "iopub.execute_input": "2024-10-29T09:21:11.736467Z",
     "iopub.status.busy": "2024-10-29T09:21:11.735762Z",
     "iopub.status.idle": "2024-10-29T09:21:11.743076Z",
     "shell.execute_reply": "2024-10-29T09:21:11.742206Z"
    },
    "id": "ZtOn9zxs2pYK",
    "papermill": {
     "duration": 0.027512,
     "end_time": "2024-10-29T09:21:11.744929",
     "exception": false,
     "start_time": "2024-10-29T09:21:11.717417",
     "status": "completed"
    },
    "tags": []
   },
   "outputs": [],
   "source": [
    "\n",
    "\n",
    "def remove_outliers(df:pd.DataFrame(), cols, beta):\n",
    "    df = df.copy()\n",
    "    for col in cols:\n",
    "#         print(f'removing {col} outliers:\\n')\n",
    "        data = df[col]\n",
    "        iqr = stats.iqr(data)\n",
    "        q1 = np.percentile(data, 25)\n",
    "        q3 = np.percentile(data, 75)\n",
    "        outlier_low = q1 - beta * iqr\n",
    "        outlier_high = q1 + beta * iqr\n",
    "#         print(f'outlier_low:{outlier_low}, outlier_high: {outlier_high}')\n",
    "        df = df[(data >= outlier_low) & (data <= outlier_high)]\n",
    "    return df\n"
   ]
  },
  {
   "cell_type": "code",
   "execution_count": 18,
   "id": "18cf40a7",
   "metadata": {
    "execution": {
     "iopub.execute_input": "2024-10-29T09:21:11.780646Z",
     "iopub.status.busy": "2024-10-29T09:21:11.780341Z",
     "iopub.status.idle": "2024-10-29T09:21:11.842931Z",
     "shell.execute_reply": "2024-10-29T09:21:11.841738Z"
    },
    "id": "CbzNHkWx2pYK",
    "outputId": "d4f41e9f-20c6-45a8-d9a6-3b153ddb7ad9",
    "papermill": {
     "duration": 0.094765,
     "end_time": "2024-10-29T09:21:11.856883",
     "exception": false,
     "start_time": "2024-10-29T09:21:11.762118",
     "status": "completed"
    },
    "tags": []
   },
   "outputs": [
    {
     "name": "stdout",
     "output_type": "stream",
     "text": [
      "removing outliers before oversampling\n",
      "removed outliers\n"
     ]
    },
    {
     "data": {
      "text/plain": [
       "((24802, 13), (58645, 13))"
      ]
     },
     "execution_count": 18,
     "metadata": {},
     "output_type": "execute_result"
    }
   ],
   "source": [
    "print(f'removing outliers before oversampling')\n",
    "df_clean = remove_outliers(train_df, num_cols, 1.5)\n",
    "# box_plots_num_cols(df_clean, num_cols)\n",
    "print('removed outliers')\n",
    "df_clean.shape, train_df.shape"
   ]
  },
  {
   "cell_type": "code",
   "execution_count": 19,
   "id": "2a50bb5a",
   "metadata": {
    "execution": {
     "iopub.execute_input": "2024-10-29T09:21:11.895869Z",
     "iopub.status.busy": "2024-10-29T09:21:11.895545Z",
     "iopub.status.idle": "2024-10-29T09:21:11.901394Z",
     "shell.execute_reply": "2024-10-29T09:21:11.900601Z"
    },
    "id": "fkP1sW402pYK",
    "papermill": {
     "duration": 0.026547,
     "end_time": "2024-10-29T09:21:11.903210",
     "exception": false,
     "start_time": "2024-10-29T09:21:11.876663",
     "status": "completed"
    },
    "tags": []
   },
   "outputs": [],
   "source": [
    "def hist_plot_cat_cols(df:pd.DataFrame(), cat_cols=cat_cols):\n",
    "    df = df.copy()\n",
    "    fig, axes_cat = plt.subplots(1, len(cat_cols), figsize=(20, 10))\n",
    "    for i, col in enumerate(cat_cols):\n",
    "        axes_cat[i].hist(df[col])\n",
    "        axes_cat[i].set_title(col)"
   ]
  },
  {
   "cell_type": "code",
   "execution_count": 20,
   "id": "3d2e7d16",
   "metadata": {
    "execution": {
     "iopub.execute_input": "2024-10-29T09:21:11.939286Z",
     "iopub.status.busy": "2024-10-29T09:21:11.938964Z",
     "iopub.status.idle": "2024-10-29T09:21:11.942686Z",
     "shell.execute_reply": "2024-10-29T09:21:11.941961Z"
    },
    "id": "XWZIcwpD2pYK",
    "papermill": {
     "duration": 0.023853,
     "end_time": "2024-10-29T09:21:11.944573",
     "exception": false,
     "start_time": "2024-10-29T09:21:11.920720",
     "status": "completed"
    },
    "tags": []
   },
   "outputs": [],
   "source": [
    "# hist_plot_cat_cols(train_df)"
   ]
  },
  {
   "cell_type": "code",
   "execution_count": 21,
   "id": "5d310354",
   "metadata": {
    "execution": {
     "iopub.execute_input": "2024-10-29T09:21:11.980839Z",
     "iopub.status.busy": "2024-10-29T09:21:11.980533Z",
     "iopub.status.idle": "2024-10-29T09:21:11.984162Z",
     "shell.execute_reply": "2024-10-29T09:21:11.983330Z"
    },
    "id": "6Daiqx6X2pYL",
    "papermill": {
     "duration": 0.023669,
     "end_time": "2024-10-29T09:21:11.985961",
     "exception": false,
     "start_time": "2024-10-29T09:21:11.962292",
     "status": "completed"
    },
    "tags": []
   },
   "outputs": [],
   "source": [
    "# hist_plot_cat_cols(df_clean)"
   ]
  },
  {
   "cell_type": "code",
   "execution_count": 22,
   "id": "fde514f1",
   "metadata": {
    "execution": {
     "iopub.execute_input": "2024-10-29T09:21:12.022129Z",
     "iopub.status.busy": "2024-10-29T09:21:12.021841Z",
     "iopub.status.idle": "2024-10-29T09:21:12.076111Z",
     "shell.execute_reply": "2024-10-29T09:21:12.075326Z"
    },
    "id": "iz0XxUy12pYL",
    "outputId": "a04b5901-3a48-4ba2-d72e-b9cef5e045fe",
    "papermill": {
     "duration": 0.074683,
     "end_time": "2024-10-29T09:21:12.078217",
     "exception": false,
     "start_time": "2024-10-29T09:21:12.003534",
     "status": "completed"
    },
    "tags": []
   },
   "outputs": [
    {
     "name": "stdout",
     "output_type": "stream",
     "text": [
      "encoding the categorical features\n"
     ]
    }
   ],
   "source": [
    "\n",
    "\n",
    "print('encoding the categorical features')\n",
    "df_clean = df_clean.drop(columns=['id'])\n",
    "\n",
    "ord_enc = OrdinalEncoder()\n",
    "one_hot_enc = OneHotEncoder(sparse_output=False)\n",
    "\n",
    "ordinal_cols = ['loan_grade']\n",
    "one_hot_cols = [col for col in cat_cols if col != 'loan_grade']\n",
    "remaining_cols = [col for col in df_clean.columns if col not in cat_cols]\n",
    "\n",
    "encoder = ColumnTransformer(\n",
    "            transformers=[\n",
    "             