      "[I 2024-10-29 10:01:00,521] Trial 169 finished with values: [0.19029828906059265, 0.9518369436264038] and parameters: {'epochs': 45, 'units': 105, 'n_hidden_layers': 4, 'batch_norm': True, 'drop_out': True, 'regularize': False, 'initializers': True, 'drop_out_rate': 0.13755803297503866, 'learning_rate': 0.003538022619894899, 'optimizer': 'Adam'}.\n",
      "[I 2024-10-29 10:01:31,203] Trial 170 finished with values: [0.19887949526309967, 0.9504928588867188] and parameters: {'epochs': 45, 'units': 100, 'n_hidden_layers': 4, 'batch_norm': True, 'drop_out': True, 'regularize': False, 'initializers': True, 'drop_out_rate': 0.14803903513010983, 'learning_rate': 0.0020978690722168124, 'optimizer': 'Adam'}.\n",
      "[I 2024-10-29 10:01:50,392] Trial 171 finished with values: [0.20628739893436432, 0.9437723755836487] and parameters: {'epochs': 45, 'units': 105, 'n_hidden_layers': 4, 'batch_norm': True, 'drop_out': True, 'regularize': False, 'initializers': True, 'drop_out_rate': 0.5040782820858403, 'learning_rate': 0.005065584300029753, 'optimizer': 'Adam'}.\n",
      "[I 2024-10-29 10:02:18,953] Trial 172 finished with values: [0.1974962204694748, 0.9520609378814697] and parameters: {'epochs': 45, 'units': 105, 'n_hidden_layers': 4, 'batch_norm': True, 'drop_out': True, 'regularize': False, 'initializers': True, 'drop_out_rate': 0.14600985036715286, 'learning_rate': 0.005405224631089444, 'optimizer': 'Adam'}.\n",
      "[I 2024-10-29 10:04:00,966] Trial 173 finished with values: [0.1867121160030365, 0.9509408473968506] and parameters: {'epochs': 45, 'units': 105, 'n_hidden_layers': 4, 'batch_norm': True, 'drop_out': True, 'regularize': False, 'initializers': True, 'drop_out_rate': 0.14793245928081342, 'learning_rate': 0.003916904586499278, 'optimizer': 'Adam'}.\n",
      "[I 2024-10-29 10:04:05,759] Trial 174 finished with values: [0.20320288836956024, 0.9529569745063782] and parameters: {'epochs': 45, 'units': 105, 'n_hidden_layers': 4, 'batch_norm': True, 'drop_out': True, 'regularize': False, 'initializers': True, 'drop_out_rate': 0.10967449468325403, 'learning_rate': 0.006039176583075321, 'optimizer': 'Adam'}.\n",
      "[I 2024-10-29 10:04:35,035] Trial 175 finished with values: [0.23718291521072388, 0.9370519518852234] and parameters: {'epochs': 44, 'units': 105, 'n_hidden_layers': 4, 'batch_norm': True, 'drop_out': True, 'regularize': False, 'initializers': True, 'drop_out_rate': 0.11658533017602091, 'learning_rate': 0.004520684999130133, 'optimizer': 'Adam'}.\n",
      "[I 2024-10-29 10:05:11,851] Trial 176 finished with values: [0.20517635345458984, 0.9529569745063782] and parameters: {'epochs': 44, 'units': 105, 'n_hidden_layers': 4, 'batch_norm': True, 'drop_out': True, 'regularize': False, 'initializers': True, 'drop_out_rate': 0.11061415183041576, 'learning_rate': 0.005104939306794679, 'optimizer': 'Adam'}.\n",
      "[I 2024-10-29 10:06:30,325] Trial 177 finished with values: [0.19502417743206024, 0.9491487741470337] and parameters: {'epochs': 44, 'units': 105, 'n_hidden_layers': 4, 'batch_norm': True, 'drop_out': True, 'regularize': False, 'initializers': True, 'drop_out_rate': 0.15378748543688836, 'learning_rate': 0.004716217246030045, 'optimizer': 'Adam'}.\n",
      "[I 2024-10-29 10:06:55,734] Trial 178 finished with values: [0.2500581741333008, 0.9370519518852234] and parameters: {'epochs': 44, 'units': 105, 'n_hidden_layers': 4, 'batch_norm': True, 'drop_out': True, 'regularize': False, 'initializers': True, 'drop_out_rate': 0.11649126029399173, 'learning_rate': 0.002682670991195031, 'optimizer': 'Adam'}.\n",
      "[I 2024-10-29 10:07:28,976] Trial 179 finished with values: [0.2252541333436966, 0.9525089859962463] and parameters: {'epochs': 44, 'units': 105, 'n_hidden_layers': 4, 'batch_norm': True, 'drop_out': True, 'regularize': False, 'initializers': True, 'drop_out_rate': 0.11081161668010635, 'learning_rate': 0.003013299972139937, 'optimizer': 'Adam'}.\n",
      "[I 2024-10-29 10:08:10,367] Trial 180 finished with values: [0.21880848705768585, 0.9520609378814697] and parameters: {'epochs': 44, 'units': 110, 'n_hidden_layers': 4, 'batch_norm': True, 'drop_out': True, 'regularize': False, 'initializers': True, 'drop_out_rate': 0.11148938893474097, 'learning_rate': 0.0030394498186569626, 'optimizer': 'Adam'}.\n",
      "[I 2024-10-29 10:09:06,515] Trial 181 finished with values: [0.1886795461177826, 0.9522849321365356] and parameters: {'epochs': 44, 'units': 100, 'n_hidden_layers': 4, 'batch_norm': True, 'drop_out': True, 'regularize': False, 'initializers': True, 'drop_out_rate': 0.1104308277016311, 'learning_rate': 0.0032554225813700983, 'optimizer': 'Adam'}.\n",
      "[I 2024-10-29 10:09:35,748] Trial 182 finished with values: [0.18770165741443634, 0.9513888955116272] and parameters: {'epochs': 44, 'units': 110, 'n_hidden_layers': 4, 'batch_norm': True, 'drop_out': True, 'regularize': False, 'initializers': True, 'drop_out_rate': 0.13198896168276203, 'learning_rate': 0.003593015399996526, 'optimizer': 'Adam'}.\n",
      "[I 2024-10-29 10:10:14,073] Trial 183 finished with values: [0.18822678923606873, 0.9525089859962463] and parameters: {'epochs': 45, 'units': 100, 'n_hidden_layers': 4, 'batch_norm': True, 'drop_out': True, 'regularize': False, 'initializers': True, 'drop_out_rate': 0.13122988653741116, 'learning_rate': 0.006848042379008072, 'optimizer': 'Adam'}.\n",
      "[I 2024-10-29 10:11:10,129] Trial 184 finished with values: [0.21506571769714355, 0.9370519518852234] and parameters: {'epochs': 45, 'units': 100, 'n_hidden_layers': 4, 'batch_norm': True, 'drop_out': True, 'regularize': False, 'initializers': True, 'drop_out_rate': 0.2269556505659975, 'learning_rate': 0.00596493771663186, 'optimizer': 'Adam'}.\n",
      "[I 2024-10-29 10:11:55,533] Trial 185 finished with values: [0.19113081693649292, 0.9513888955116272] and parameters: {'epochs': 45, 'units': 100, 'n_hidden_layers': 4, 'batch_norm': True, 'drop_out': True, 'regularize': False, 'initializers': True, 'drop_out_rate': 0.13057448705340702, 'learning_rate': 0.006067665791691562, 'optimizer': 'Adam'}.\n",
      "[I 2024-10-29 10:12:15,244] Trial 186 finished with values: [0.19799892604351044, 0.9498208165168762] and parameters: {'epochs': 45, 'units': 110, 'n_hidden_layers': 4, 'batch_norm': True, 'drop_out': True, 'regularize': False, 'initializers': True, 'drop_out_rate': 0.17376367237411242, 'learning_rate': 0.00724694428320239, 'optimizer': 'Adam'}.\n",
      "[I 2024-10-29 10:13:05,186] Trial 187 finished with values: [0.22769980132579803, 0.9370519518852234] and parameters: {'epochs': 45, 'units': 105, 'n_hidden_layers': 4, 'batch_norm': True, 'drop_out': True, 'regularize': False, 'initializers': True, 'drop_out_rate': 0.1301168764349639, 'learning_rate': 0.006485005214586902, 'optimizer': 'Adam'}.\n",
      "[I 2024-10-29 10:14:03,202] Trial 188 finished with values: [0.2275235652923584, 0.9370519518852234] and parameters: {'epochs': 45, 'units': 105, 'n_hidden_layers': 4, 'batch_norm': True, 'drop_out': True, 'regularize': False, 'initializers': True, 'drop_out_rate': 0.14009283110522697, 'learning_rate': 0.006982251912193348, 'optimizer': 'Adam'}.\n",
      "[I 2024-10-29 10:14:41,229] Trial 189 finished with values: [0.18562383949756622, 0.9511649012565613] and parameters: {'epochs': 44, 'units': 105, 'n_hidden_layers': 4, 'batch_norm': True, 'drop_out': True, 'regularize': False, 'initializers': True, 'drop_out_rate': 0.1722299187946975, 'learning_rate': 0.008146035578222181, 'optimizer': 'Adam'}.\n",
      "[I 2024-10-29 10:14:55,881] Trial 190 finished with values: [0.20527788996696472, 0.9520609378814697] and parameters: {'epochs': 44, 'units': 105, 'n_hidden_layers': 4, 'batch_norm': True, 'drop_out': True, 'regularize': False, 'initializers': True, 'drop_out_rate': 0.1289226573084151, 'learning_rate': 0.008933460629247696, 'optimizer': 'Adam'}.\n",
      "[I 2024-10-29 10:15:45,638] Trial 191 finished with values: [0.20850364863872528, 0.9529569745063782] and parameters: {'epochs': 44, 'units': 110, 'n_hidden_layers': 4, 'batch_norm': True, 'drop_out': True, 'regularize': False, 'initializers': True, 'drop_out_rate': 0.10808855951041105, 'learning_rate': 0.0032584635666048026, 'optimizer': 'Adam'}.\n",
      "[I 2024-10-29 10:16:37,896] Trial 192 finished with values: [0.25126969814300537, 0.9484767317771912] and parameters: {'epochs': 43, 'units': 105, 'n_hidden_layers': 4, 'batch_norm': True, 'drop_out': True, 'regularize': False, 'initializers': True, 'drop_out_rate': 0.05976839337057343, 'learning_rate': 0.0036528672154004698, 'optimizer': 'Adam'}.\n",
      "[I 2024-10-29 10:17:32,758] Trial 194 finished with values: [0.2462809532880783, 0.9370519518852234] and parameters: {'epochs': 44, 'units': 110, 'n_hidden_layers': 4, 'batch_norm': True, 'drop_out': True, 'regularize': False, 'initializers': True, 'drop_out_rate': 0.10357027982384538, 'learning_rate': 0.0033914471869113134, 'optimizer': 'Adam'}.\n",
      "[I 2024-10-29 10:17:43,449] Trial 193 finished with values: [0.21059775352478027, 0.9502688050270081] and parameters: {'epochs': 44, 'units': 115, 'n_hidden_layers': 4, 'batch_norm': True, 'drop_out': True, 'regularize': False, 'initializers': True, 'drop_out_rate': 0.10738624630149968, 'learning_rate': 0.003539955592519114, 'optimizer': 'Adam'}.\n",
      "[I 2024-10-29 10:18:26,659] Trial 195 finished with values: [0.2510371804237366, 0.9464605450630188] and parameters: {'epochs': 43, 'units': 110, 'n_hidden_layers': 4, 'batch_norm': True, 'drop_out': True, 'regularize': False, 'initializers': True, 'drop_out_rate': 0.0545758990258805, 'learning_rate': 0.0035293631717326626, 'optimizer': 'Adam'}.\n",
      "[I 2024-10-29 10:19:10,093] Trial 196 finished with values: [0.2472354769706726, 0.9480286836624146] and parameters: {'epochs': 43, 'units': 110, 'n_hidden_layers': 4, 'batch_norm': True, 'drop_out': True, 'regularize': False, 'initializers': True, 'drop_out_rate': 0.056540475490659686, 'learning_rate': 0.00404522944827714, 'optimizer': 'Adam'}.\n",
      "[I 2024-10-29 10:20:10,264] Trial 198 finished with values: [0.2870546579360962, 0.9498208165168762] and parameters: {'epochs': 43, 'units': 110, 'n_hidden_layers': 3, 'batch_norm': True, 'drop_out': True, 'regularize': False, 'initializers': True, 'drop_out_rate': 0.05771378891608373, 'learning_rate': 0.008041262107217808, 'optimizer': 'Adam'}.\n",
      "[I 2024-10-29 10:20:11,143] Trial 197 finished with values: [0.20917485654354095, 0.9493727684020996] and parameters: {'epochs': 43, 'units': 115, 'n_hidden_layers': 4, 'batch_norm': True, 'drop_out': True, 'regularize': False, 'initializers': True, 'drop_out_rate': 0.05941267830255548, 'learning_rate': 0.003974567375060208, 'optimizer': 'Adam'}.\n",
      "[I 2024-10-29 10:20:45,455] Trial 199 finished with values: [0.2480260580778122, 0.9520609378814697] and parameters: {'epochs': 43, 'units': 100, 'n_hidden_layers': 3, 'batch_norm': True, 'drop_out': True, 'regularize': False, 'initializers': True, 'drop_out_rate': 0.07091089699569383, 'learning_rate': 0.01203549803887368, 'optimizer': 'Adam'}.\n",
      "[I 2024-10-29 10:21:32,305] Trial 200 finished with values: [0.24427467584609985, 0.9536290168762207] and parameters: {'epochs': 43, 'units': 100, 'n_hidden_layers': 3, 'batch_norm': True, 'drop_out': True, 'regularize': False, 'initializers': True, 'drop_out_rate': 0.07596767465763393, 'learning_rate': 0.008448032618612942, 'optimizer': 'Adam'}.\n",
      "[I 2024-10-29 10:22:14,747] Trial 201 finished with values: [0.29360926151275635, 0.9484767317771912] and parameters: {'epochs': 44, 'units': 105, 'n_hidden_layers': 2, 'batch_norm': True, 'drop_out': True, 'regularize': False, 'initializers': True, 'drop_out_rate': 0.07548675435417354, 'learning_rate': 0.00018099718829430752, 'optimizer': 'Adam'}.\n",
      "[I 2024-10-29 10:22:36,017] Trial 202 finished with values: [0.30016857385635376, 0.947356641292572] and parameters: {'epochs': 44, 'units': 100, 'n_hidden_layers': 2, 'batch_norm': True, 'drop_out': True, 'regularize': False, 'initializers': True, 'drop_out_rate': 0.08136293340382751, 'learning_rate': 0.012639843876595058, 'optimizer': 'Adam'}.\n",
      "[I 2024-10-29 10:23:10,012] Trial 203 finished with values: [0.2486743927001953, 0.9509408473968506] and parameters: {'epochs': 44, 'units': 155, 'n_hidden_layers': 2, 'batch_norm': True, 'drop_out': True, 'regularize': False, 'initializers': True, 'drop_out_rate': 0.2147931142721772, 'learning_rate': 0.002461387021440153, 'optimizer': 'Adam'}.\n",
      "[I 2024-10-29 10:23:31,144] Trial 204 finished with values: [0.6412969827651978, 0.9262992739677429] and parameters: {'epochs': 44, 'units': 105, 'n_hidden_layers': 3, 'batch_norm': False, 'drop_out': False, 'regularize': True, 'initializers': True, 'drop_out_rate': 0.07995657744881965, 'learning_rate': 0.005452565367889496, 'optimizer': 'Adam'}.\n",
      "[I 2024-10-29 10:24:17,592] Trial 205 finished with values: [0.6043422222137451, 0.9269713163375854] and parameters: {'epochs': 44, 'units': 105, 'n_hidden_layers': 3, 'batch_norm': False, 'drop_out': False, 'regularize': True, 'initializers': True, 'drop_out_rate': 0.08824188195966201, 'learning_rate': 0.0022177128459895776, 'optimizer': 'Adam'}.\n",
      "[I 2024-10-29 10:24:31,107] Trial 207 finished with values: [0.501507043838501, 0.9327957034111023] and parameters: {'epochs': 30, 'units': 105, 'n_hidden_layers': 3, 'batch_norm': False, 'drop_out': False, 'regularize': True, 'initializers': True, 'drop_out_rate': 0.44278104561201026, 'learning_rate': 0.001683795984976774, 'optimizer': 'Adam'}.\n",
      "[I 2024-10-29 10:24:31,148] Trial 206 finished with values: [0.604596734046936, 0.9368279576301575] and parameters: {'epochs': 44, 'units': 105, 'n_hidden_layers': 3, 'batch_norm': False, 'drop_out': False, 'regularize': True, 'initializers': True, 'drop_out_rate': 0.0833115110165753, 'learning_rate': 0.0023662787271760584, 'optimizer': 'Adam'}.\n",
      "[I 2024-10-29 10:25:06,104] Trial 208 finished with values: [0.5012018084526062, 0.9330196976661682] and parameters: {'epochs': 34, 'units': 105, 'n_hidden_layers': 3, 'batch_norm': False, 'drop_out': False, 'regularize': True, 'initializers': False, 'drop_out_rate': 0.09611022209024905, 'learning_rate': 0.001464996455006911, 'optimizer': 'Adam'}.\n",
      "[I 2024-10-29 10:25:54,492] Trial 209 finished with values: [0.45205506682395935, 0.9343637824058533] and parameters: {'epochs': 30, 'units': 105, 'n_hidden_layers': 3, 'batch_norm': False, 'drop_out': False, 'regularize': True, 'initializers': False, 'drop_out_rate': 0.10054248949883338, 'learning_rate': 0.0014768289166251973, 'optimizer': 'Adam'}.\n",
      "[I 2024-10-29 10:26:57,253] Trial 210 finished with values: [0.24165070056915283, 0.9513888955116272] and parameters: {'epochs': 42, 'units': 105, 'n_hidden_layers': 3, 'batch_norm': True, 'drop_out': True, 'regularize': False, 'initializers': False, 'drop_out_rate': 0.10064047203930133, 'learning_rate': 0.008664380458362942, 'optimizer': 'Adam'}.\n",
      "[I 2024-10-29 10:27:05,479] Trial 211 finished with values: [0.2223552018404007, 0.9529569745063782] and parameters: {'epochs': 42, 'units': 105, 'n_hidden_layers': 3, 'batch_norm': True, 'drop_out': True, 'regularize': False, 'initializers': False, 'drop_out_rate': 0.09883503411088355, 'learning_rate': 0.0688917892936986, 'optimizer': 'Adam'}.\n",
      "[I 2024-10-29 10:28:02,474] Trial 212 finished with values: [0.23186185956001282, 0.9370519518852234] and parameters: {'epochs': 42, 'units': 110, 'n_hidden_layers': 5, 'batch_norm': True, 'drop_out': True, 'regularize': False, 'initializers': False, 'drop_out_rate': 0.11464153449395151, 'learning_rate': 0.005022446474352951, 'optimizer': 'Adam'}.\n",
      "[I 2024-10-29 10:28:46,204] Trial 213 finished with values: [0.23405809700489044, 0.9370519518852234] and parameters: {'epochs': 42, 'units': 140, 'n_hidden_layers': 5, 'batch_norm': True, 'drop_out': True, 'regularize': False, 'initializers': True, 'drop_out_rate': 0.1223820308025304, 'learning_rate': 0.008479727659202551, 'optimizer': 'Adam'}.\n",
      "[I 2024-10-29 10:29:10,150] Trial 215 finished with values: [0.21036304533481598, 0.9370519518852234] and parameters: {'epochs': 28, 'units': 100, 'n_hidden_layers': 5, 'batch_norm': True, 'drop_out': True, 'regularize': False, 'initializers': True, 'drop_out_rate': 0.34828445243522943, 'learning_rate': 0.004904057843149625, 'optimizer': 'Adam'}.\n",
      "[I 2024-10-29 10:29:49,202] Trial 214 finished with values: [0.2353568971157074, 0.9370519518852234] and parameters: {'epochs': 42, 'units': 100, 'n_hidden_layers': 5, 'batch_norm': True, 'drop_out': True, 'regularize': False, 'initializers': True, 'drop_out_rate': 0.580263117624341, 'learning_rate': 2.5969862673047758e-05, 'optimizer': 'Adam'}.\n",
      "[I 2024-10-29 10:30:52,107] Trial 216 finished with values: [0.23610782623291016, 0.9370519518852234] and parameters: {'epochs': 43, 'units': 100, 'n_hidden_layers': 5, 'batch_norm': True, 'drop_out': True, 'regularize': False, 'initializers': True, 'drop_out_rate': 0.5951664661284747, 'learning_rate': 0.006409256463195987, 'optimizer': 'Adam'}.\n",
      "[I 2024-10-29 10:31:26,502] Trial 217 finished with values: [0.2352587729692459, 0.9370519518852234] and parameters: {'epochs': 45, 'units': 100, 'n_hidden_layers': 5, 'batch_norm': True, 'drop_out': True, 'regularize': False, 'initializers': True, 'drop_out_rate': 0.7525234464424916, 'learning_rate': 0.006737347422984973, 'optimizer': 'Adam'}.\n",
      "stopping the study\n",
      "[I 2024-10-29 10:31:37,877] Trial 218 finished with values: [0.19473806023597717, 0.9457885026931763] and parameters: {'epochs': 45, 'units': 135, 'n_hidden_layers': 5, 'batch_norm': True, 'drop_out': True, 'regularize': False, 'initializers': True, 'drop_out_rate': 0.03775487032671989, 'learning_rate': 0.006559739238911348, 'optimizer': 'SGD'}.\n",
      "[I 2024-10-29 10:31:49,327] Trial 219 finished with values: [0.19844688475131989, 0.9401881694793701] and parameters: {'epochs': 45, 'units': 155, 'n_hidden_layers': 2, 'batch_norm': True, 'drop_out': True, 'regularize': False, 'initializers': True, 'drop_out_rate': 0.5068607451797555, 'learning_rate': 2.16219472152134e-06, 'optimizer': 'SGD'}.\n",
