      "[I 2024-10-29 10:32:11,167] Trial 220 finished with values: [0.18331561982631683, 0.9487007260322571] and parameters: {'epochs': 45, 'units': 110, 'n_hidden_layers': 2, 'batch_norm': True, 'drop_out': True, 'regularize': False, 'initializers': True, 'drop_out_rate': 0.27390464831762973, 'learning_rate': 0.017576128337789796, 'optimizer': 'SGD'}.\n",
      "study completed\n"
     ]
    }
   ],
   "source": [
    "\n",
    "n_trials=500\n",
    "patience = 100\n",
    "early_stopping_cb = EarlyStoppingCallbackMinimize(patience=patience)\n",
    "\n",
    "previous_study_file_path = \"/kaggle/working/loan_approval_ann_study.db\"\n",
    "if os.path.exists(previous_study_file_path):\n",
    "    print(f'found the previous study at {previous_study_file_path}')\n",
    "    print('resuming the study')\n",
    "    loan_approval_ann_study = optuna.load_study(study_name=\"loan_approval_ann_study\", storage=\"sqlite:///\" + previous_study_file_path)\n",
    "else:\n",
    "    print('creating a new study')\n",
    "     \n",
    "    loan_approval_ann_study = optuna.create_study(\n",
    "    storage='sqlite:///loan_approval_ann_study.db',\n",
    "    study_name='loan_approval_ann_study',\n",
    "    directions=['minimize', 'maximize'],\n",
    "    load_if_exists=True\n",
    "    )\n",
    "print(f'created the study with name: {loan_approval_ann_study.study_name}')\n",
    "loan_approval_ann_study.optimize(objective,  n_trials=n_trials, show_progress_bar=True,callbacks=[early_stopping_cb], n_jobs=-1)\n",
    "print('study completed')\n"
   ]
  },
  {
   "cell_type": "code",
   "execution_count": 42,
   "id": "03a7d845",
   "metadata": {
    "execution": {
     "iopub.execute_input": "2024-10-29T10:32:11.259586Z",
     "iopub.status.busy": "2024-10-29T10:32:11.258899Z",
     "iopub.status.idle": "2024-10-29T10:32:11.300816Z",
     "shell.execute_reply": "2024-10-29T10:32:11.300063Z"
    },
    "papermill": {
     "duration": 0.072678,
     "end_time": "2024-10-29T10:32:11.302815",
     "exception": false,
     "start_time": "2024-10-29T10:32:11.230137",
     "status": "completed"
    },
    "tags": []
   },
   "outputs": [],
   "source": [
    "resumed_study = optuna.load_study(storage=\"sqlite:////kaggle/working/loan_approval_ann_study.db\", study_name=\"loan_approval_ann_study\")"
   ]
  },
  {
   "cell_type": "code",
   "execution_count": 43,
   "id": "99b29def",
   "metadata": {
    "execution": {
     "iopub.execute_input": "2024-10-29T10:32:11.359032Z",
     "iopub.status.busy": "2024-10-29T10:32:11.358379Z",
     "iopub.status.idle": "2024-10-29T10:32:11.671023Z",
     "shell.execute_reply": "2024-10-29T10:32:11.669937Z"
    },
    "papermill": {
     "duration": 0.342843,
     "end_time": "2024-10-29T10:32:11.673022",
     "exception": false,
     "start_time": "2024-10-29T10:32:11.330179",
     "status": "completed"
    },
    "tags": []
   },
   "outputs": [
    {
     "name": "stdout",
     "output_type": "stream",
     "text": [
      "{'epochs': 44, 'units': 105, 'n_hidden_layers': 4, 'batch_norm': True, 'drop_out': True, 'regularize': False, 'initializers': True, 'drop_out_rate': 0.09403147989618182, 'learning_rate': 0.005532408528428981, 'optimizer': 'Adam'}\n",
      "[0.19904504716396332, 0.9538530707359314]\n"
     ]
    }
   ],
   "source": [
    "# resumed_study = loan_approval_ann_study\n",
    "best_value = 0\n",
    "for trial in resumed_study.best_trials:\n",
    "    curr = trial.values[0]\n",
    "    if curr >= best_value:\n",
    "        best_value = curr\n",
    "\n",
    "for trial in resumed_study.best_trials:\n",
    "    n = trial.values[0]\n",
    "    if n >= best_value:\n",
    "        print(trial.params)\n",
    "        best_params = trial.params\n",
    "        print(trial.values)"
   ]
  },
  {
   "cell_type": "code",
   "execution_count": 44,
   "id": "bf19e9da",
   "metadata": {
    "execution": {
     "iopub.execute_input": "2024-10-29T10:32:11.729503Z",
     "iopub.status.busy": "2024-10-29T10:32:11.729126Z",
     "iopub.status.idle": "2024-10-29T10:32:11.735402Z",
     "shell.execute_reply": "2024-10-29T10:32:11.734522Z"
    },
    "papermill": {
     "duration": 0.036466,
     "end_time": "2024-10-29T10:32:11.737294",
     "exception": false,
     "start_time": "2024-10-29T10:32:11.700828",
     "status": "completed"
    },
    "tags": []
   },
   "outputs": [
    {
     "data": {
      "text/plain": [
       "{'epochs': 44,\n",
       " 'units': 105,\n",
       " 'n_hidden_layers': 4,\n",
       " 'batch_norm': True,\n",
       " 'drop_out': True,\n",
       " 'regularize': False,\n",
       " 'initializers': True,\n",
       " 'drop_out_rate': 0.09403147989618182,\n",
       " 'learning_rate': 0.005532408528428981,\n",
       " 'optimizer': 'Adam'}"
      ]
     },
     "execution_count": 44,
     "metadata": {},
     "output_type": "execute_result"
    }
   ],
   "source": [
    "best_params"
   ]
  },
  {
   "cell_type": "code",
   "execution_count": 45,
   "id": "1151495e",
   "metadata": {
    "execution": {
     "iopub.execute_input": "2024-10-29T10:32:11.793364Z",
     "iopub.status.busy": "2024-10-29T10:32:11.793030Z",
     "iopub.status.idle": "2024-10-29T10:32:12.231299Z",
     "shell.execute_reply": "2024-10-29T10:32:12.230251Z"
    },
    "papermill": {
     "duration": 0.46906,
     "end_time": "2024-10-29T10:32:12.233790",
     "exception": false,
     "start_time": "2024-10-29T10:32:11.764730",
     "status": "completed"
    },
    "tags": []
   },
   "outputs": [],
   "source": [
    "final_train_dataset, = prepare_data_for_tpu(df_train, batch_size=64, features_cols=features_cols, target_col=target_col, poly=True, poly_degree=3, valid_split=False)\n",
    "final_input_shape = final_train_dataset.element_spec[0].shape[1]  # Assuming first element is the feature tensor\n"
   ]
  },
  {
   "cell_type": "code",
   "execution_count": 46,
   "id": "77b663d6",
   "metadata": {
    "execution": {
     "iopub.execute_input": "2024-10-29T10:32:12.290688Z",
     "iopub.status.busy": "2024-10-29T10:32:12.290351Z",
     "iopub.status.idle": "2024-10-29T10:32:12.454152Z",
     "shell.execute_reply": "2024-10-29T10:32:12.453276Z"
    },
    "papermill": {
     "duration": 0.194328,
     "end_time": "2024-10-29T10:32:12.456185",
     "exception": false,
     "start_time": "2024-10-29T10:32:12.261857",
     "status": "completed"
    },
    "tags": []
   },
   "outputs": [
    {
     "data": {
      "text/html": [
       "<pre style=\"white-space:pre;overflow-x:auto;line-height:normal;font-family:Menlo,'DejaVu Sans Mono',consolas,'Courier New',monospace\"><span style=\"font-weight: bold\">Model: \"sequential\"</span>\n",
       "</pre>\n"
      ],
      "text/plain": [
       "\u001b[1mModel: \"sequential\"\u001b[0m\n"
      ]
     },
     "metadata": {},
     "output_type": "display_data"
    },
    {
     "data": {
      "text/html": [
       "<pre style=\"white-space:pre;overflow-x:auto;line-height:normal;font-family:Menlo,'DejaVu Sans Mono',consolas,'Courier New',monospace\">┏━━━━━━━━━━━━━━━━━━━━━━━━━━━━━━━━━┳━━━━━━━━━━━━━━━━━━━━━━━━┳━━━━━━━━━━━━━━━┓\n",
       "┃<span style=\"font-weight: bold\"> Layer (type)                    </span>┃<span style=\"font-weight: bold\"> Output Shape           </span>┃<span style=\"font-weight: bold\">       Param # </span>┃\n",
       "┡━━━━━━━━━━━━━━━━━━━━━━━━━━━━━━━━━╇━━━━━━━━━━━━━━━━━━━━━━━━╇━━━━━━━━━━━━━━━┩\n",
       "│ dense (<span style=\"color: #0087ff; text-decoration-color: #0087ff\">Dense</span>)                   │ (<span style=\"color: #00d7ff; text-decoration-color: #00d7ff\">None</span>, <span style=\"color: #00af00; text-decoration-color: #00af00\">105</span>)            │       <span style=\"color: #00af00; text-decoration-color: #00af00\">121,800</span> │\n",
       "├─────────────────────────────────┼────────────────────────┼───────────────┤\n",
       "│ dropout (<span style=\"color: #0087ff; text-decoration-color: #0087ff\">Dropout</span>)               │ (<span style=\"color: #00d7ff; text-decoration-color: #00d7ff\">None</span>, <span style=\"color: #00af00; text-decoration-color: #00af00\">105</span>)            │             <span style=\"color: #00af00; text-decoration-color: #00af00\">0</span> │\n",
       "├─────────────────────────────────┼────────────────────────┼───────────────┤\n",
       "│ batch_normalization             │ (<span style=\"color: #00d7ff; text-decoration-color: #00d7ff\">None</span>, <span style=\"color: #00af00; text-decoration-color: #00af00\">105</span>)            │           <span style=\"color: #00af00; text-decoration-color: #00af00\">420</span> │\n",
       "│ (<span style=\"color: #0087ff; text-decoration-color: #0087ff\">BatchNormalization</span>)            │                        │               │\n",
       "├─────────────────────────────────┼────────────────────────┼───────────────┤\n",
       "│ dense_1 (<span style=\"color: #0087ff; text-decoration-color: #0087ff\">Dense</span>)                 │ (<span style=\"color: #00d7ff; text-decoration-color: #00d7ff\">None</span>, <span style=\"color: #00af00; text-decoration-color: #00af00\">26</span>)             │         <span style=\"color: #00af00; text-decoration-color: #00af00\">2,756</span> │\n",
       "├─────────────────────────────────┼────────────────────────┼───────────────┤\n",
       "│ dropout_1 (<span style=\"color: #0087ff; text-decoration-color: #0087ff\">Dropout</span>)             │ (<span style=\"color: #00d7ff; text-decoration-color: #00d7ff\">None</span>, <span style=\"color: #00af00; text-decoration-color: #00af00\">26</span>)             │             <span style=\"color: #00af00; text-decoration-color: #00af00\">0</span> │\n",
       "├─────────────────────────────────┼────────────────────────┼───────────────┤\n",
       "│ batch_normalization_1           │ (<span style=\"color: #00d7ff; text-decoration-color: #00d7ff\">None</span>, <span style=\"color: #00af00; text-decoration-color: #00af00\">26</span>)             │           <span style=\"color: #00af00; text-decoration-color: #00af00\">104</span> │\n",
       "│ (<span style=\"color: #0087ff; text-decoration-color: #0087ff\">BatchNormalization</span>)            │                        │               │\n",
       "├─────────────────────────────────┼────────────────────────┼───────────────┤\n",
       "│ dense_2 (<span style=\"color: #0087ff; text-decoration-color: #0087ff\">Dense</span>)                 │ (<span style=\"color: #00d7ff; text-decoration-color: #00d7ff\">None</span>, <span style=\"color: #00af00; text-decoration-color: #00af00\">6</span>)              │           <span style=\"color: #00af00; text-decoration-color: #00af00\">162</span> │\n",
       "├─────────────────────────────────┼────────────────────────┼───────────────┤\n",
       "│ dropout_2 (<span style=\"color: #0087ff; text-decoration-color: #0087ff\">Dropout</span>)             │ (<span style=\"color: #00d7ff; text-decoration-color: #00d7ff\">None</span>, <span style=\"color: #00af00; text-decoration-color: #00af00\">6</span>)              │             <span style=\"color: #00af00; text-decoration-color: #00af00\">0</span> │\n",
       "├─────────────────────────────────┼────────────────────────┼───────────────┤\n",
       "│ batch_normalization_2           │ (<span style=\"color: #00d7ff; text-decoration-color: #00d7ff\">None</span>, <span style=\"color: #00af00; text-decoration-color: #00af00\">6</span>)              │            <span style=\"color: #00af00; text-decoration-color: #00af00\">24</span> │\n",
       "│ (<span style=\"color: #0087ff; text-decoration-color: #0087ff\">BatchNormalization</span>)            │                        │               │\n",
       "├─────────────────────────────────┼────────────────────────┼───────────────┤\n",
       "│ dense_3 (<span style=\"color: #0087ff; text-decoration-color: #0087ff\">Dense</span>)                 │ (<span style=\"color: #00d7ff; text-decoration-color: #00d7ff\">None</span>, <span style=\"color: #00af00; text-decoration-color: #00af00\">2</span>)              │            <span style=\"color: #00af00; text-decoration-color: #00af00\">14</span> │\n",
       "├─────────────────────────────────┼────────────────────────┼───────────────┤\n",
       "│ dropout_3 (<span style=\"color: #0087ff; text-decoration-color: #0087ff\">Dropout</span>)             │ (<span style=\"color: #00d7ff; text-decoration-color: #00d7ff\">None</span>, <span style=\"color: #00af00; text-decoration-color: #00af00\">2</span>)              │             <span style=\"color: #00af00; text-decoration-color: #00af00\">0</span> │\n",
       "├─────────────────────────────────┼────────────────────────┼───────────────┤\n",
       "│ batch_normalization_3           │ (<span style=\"color: #00d7ff; text-decoration-color: #00d7ff\">None</span>, <span style=\"color: #00af00; text-decoration-color: #00af00\">2</span>)              │             <span style=\"color: #00af00; text-decoration-color: #00af00\">8</span> │\n",
       "│ (<span style=\"color: #0087ff; text-decoration-color: #0087ff\">BatchNormalization</span>)            │                        │               │\n",
       "├─────────────────────────────────┼────────────────────────┼───────────────┤\n",
       "│ dense_4 (<span style=\"color: #0087ff; text-decoration-color: #0087ff\">Dense</span>)                 │ (<span style=\"color: #00d7ff; text-decoration-color: #00d7ff\">None</span>, <span style=\"color: #00af00; text-decoration-color: #00af00\">1</span>)              │             <span style=\"color: #00af00; text-decoration-color: #00af00\">3</span> │\n",
       "└─────────────────────────────────┴────────────────────────┴───────────────┘\n",
       "</pre>\n"
      ],
      "text/plain": [
       "┏━━━━━━━━━━━━━━━━━━━━━━━━━━━━━━━━━┳━━━━━━━━━━━━━━━━━━━━━━━━┳━━━━━━━━━━━━━━━┓\n",
       "┃\u001b[1m \u001b[0m\u001b[1mLayer (type)                   \u001b[0m\u001b[1m \u001b[0m┃\u001b[1m \u001b[0m\u001b[1mOutput Shape          \u001b[0m\u001b[1m \u001b[0m┃\u001b[1m \u001b[0m\u001b[1m      Param #\u001b[0m\u001b[1m \u001b[0m┃\n",
       "┡━━━━━━━━━━━━━━━━━━━━━━━━━━━━━━━━━╇━━━━━━━━━━━━━━━━━━━━━━━━╇━━━━━━━━━━━━━━━┩\n",
       "│ dense (\u001b[38;5;33mDense\u001b[0m)                   │ (\u001b[38;5;45mNone\u001b[0m, \u001b[38;5;34m105\u001b[0m)            │       \u001b[38;5;34m121,800\u001b[0m │\n",
       "├─────────────────────────────────┼────────────────────────┼───────────────┤\n",
       "│ dropout (\u001b[38;5;33mDropout\u001b[0m)               │ (\u001b[38;5;45mNone\u001b[0m, \u001b[38;5;34m105\u001b[0m)            │             \u001b[38;5;34m0\u001b[0m │\n",
       "├─────────────────────────────────┼────────────────────────┼───────────────┤\n",
       "│ batch_normalization             │ (\u001b[38;5;45mNone\u001b[0m, \u001b[38;5;34m105\u001b[0m)            │           \u001b[38;5;34m420\u001b[0m │\n",
       "│ (\u001b[38;5;33mBatchNormalization\u001b[0m)            │                        │               │\n",
       "├─────────────────────────────────┼────────────────────────┼───────────────┤\n",
       "│ dense_1 (\u001b[38;5;33mDense\u001b[0m)                 │ (\u001b[38;5;45mNone\u001b[0m, \u001b[38;5;34m26\u001b[0m)             │         \u001b[38;5;34m2,756\u001b[0m │\n",
       "├─────────────────────────────────┼────────────────────────┼───────────────┤\n",
       "│ dropout_1 (\u001b[38;5;33mDropout\u001b[0m)             │ (\u001b[38;5;45mNone\u001b[0m, \u001b[38;5;34m26\u001b[0m)             │             \u001b[38;5;34m0\u001b[0m │\n",
       "├─────────────────────────────────┼────────────────────────┼───────────────┤\n",
       "│ batch_normalization_1           │ (\u001b[38;5;45mNone\u001b[0m, \u001b[38;5;34m26\u001b[0m)             │           \u001b[38;5;34m104\u001b[0m │\n",
       "│ (\u001b[38;5;33mBatchNormalization\u001b[0m)            │                        │               │\n",
       "├─────────────────────────────────┼────────────────────────┼───────────────┤\n",
       "│ dense_2 (\u001b[38;5;33mDense\u001b[0m)                 │ (\u001b[38;5;45mNone\u001b[0m, \u001b[38;5;34m6\u001b[0m)              │           \u001b[38;5;34m162\u001b[0m │\n",
       "├─────────────────────────────────┼────────────────────────┼───────────────┤\n",
       "│ dropout_2 (\u001b[38;5;33mDropout\u001b[0m)             │ (\u001b[38;5;45mNone\u001b[0m, \u001b[38;5;34m6\u001b[0m)              │             \u001b[38;5;34m0\u001b[0m │\n",
       "├─────────────────────────────────┼────────────────────────┼───────────────┤\n",
       "│ batch_normalization_2           │ (\u001b[38;5;45mNone\u001b[0m, \u001b[38;5;34m6\u001b[0m)              │            \u001b[38;5;34m24\u001b[0m │\n",
       "│ (\u001b[38;5;33mBatchNormalization\u001b[0m)            │                        │               │\n",
       "├─────────────────────────────────┼────────────────────────┼───────────────┤\n",
       "│ dense_3 (\u001b[38;5;33mDense\u001b[0m)                 │ (\u001b[38;5;45mNone\u001b[0m, \u001b[38;5;34m2\u001b[0m)              │            \u001b[38;5;34m14\u001b[0m │\n",
       "├─────────────────────────────────┼────────────────────────┼───────────────┤\n",
       "│ dropout_3 (\u001b[38;5;33mDropout\u001b[0m)             │ (\u001b[38;5;45mNone\u001b[0m, \u001b[38;5;34m2\u001b[0m)              │             \u001b[38;5;34m0\u001b[0m │\n",
       "├─────────────────────────────────┼────────────────────────┼───────────────┤\n",
       "│ batch_normalization_3           │ (\u001b[38;5;45mNone\u001b[0m, \u001b[38;5;34m2\u001b[0m)              │             \u001b[38;5;34m8\u001b[0m │\n",
       "│ (\u001b[38;5;33mBatchNormalization\u001b[0m)            │                        │               │\n",
       "├─────────────────────────────────┼────────────────────────┼───────────────┤\n",
       "│ dense_4 (\u001b[38;5;33mDense\u001b[0m)                 │ (\u001b[38;5;45mNone\u001b[0m, \u001b[38;5;34m1\u001b[0m)              │             \u001b[38;5;34m3\u001b[0m │\n",
       "└─────────────────────────────────┴────────────────────────┴───────────────┘\n"
      ]
     },
     "metadata": {},
     "output_type": "display_data"
    },
    {
     "data": {
      "text/html": [
       "<pre style=\"white-space:pre;overflow-x:auto;line-height:normal;font-family:Menlo,'DejaVu Sans Mono',consolas,'Courier New',monospace\"><span style=\"font-weight: bold\"> Total params: </span><span style=\"color: #00af00; text-decoration-color: #00af00\">125,291</span> (489.42 KB)\n",
       "</pre>\n"
      ],
      "text/plain": [
       "\u001b[1m Total params: \u001b[0m\u001b[38;5;34m125,291\u001b[0m (489.42 KB)\n"
      ]
     },
     "metadata": {},
     "output_type": "display_data"
    },
    {
     "data": {
      "text/html": [
       "<pre style=\"white-space:pre;overflow-x:auto;line-height:normal;font-family:Menlo,'DejaVu Sans Mono',consolas,'Courier New',monospace\"><span style=\"font-weight: bold\"> Trainable params: </span><span style=\"color: #00af00; text-decoration-color: #00af00\">125,013</span> (488.33 KB)\n",
       "</pre>\n"
      ],
      "text/plain": [
       "\u001b[1m Trainable params: \u001b[0m\u001b[38;5;34m125,013\u001b[0m (488.33 KB)\n"
      ]
     },
     "metadata": {},
     "output_type": "display_data"
    },
    {
     "data": {
      "text/html": [
       "<pre style=\"white-space:pre;overflow-x:auto;line-height:normal;font-family:Menlo,'DejaVu Sans Mono',consolas,'Courier New',monospace\"><span style=\"font-weight: bold\"> Non-trainable params: </span><span style=\"color: #00af00; text-decoration-color: #00af00\">278</span> (1.09 KB)\n",
       "</pre>\n"
      ],
      "text/plain": [
       "\u001b[1m Non-trainable params: \u001b[0m\u001b[38;5;34m278\u001b[0m (1.09 KB)\n"
      ]
     },
     "metadata": {},
     "output_type": "display_data"
    }
   ],
   "source": [
    "\n",
    "final_model = build_model(\n",
    "    input_shape=final_input_shape,\n",
    "    units=best_params['units'],\n",
    "    n_hidden_layers=best_params['n_hidden_layers'],\n",
    "    batch_norm=best_params['batch_norm'],\n",
    "    drop_out=best_params['drop_out'],\n",
    "    regularize=best_params['regularize'],\n",
    "    initializers=best_params['initializers'],\n",
    "    drop_out_rate=best_params['drop_out_rate'],\n",
    ")\n",
    "final_model.summary()"
   ]
  },
  {
   "cell_type": "code",
   "execution_count": 47,
   "id": "6f8bc35f",
   "metadata": {
    "execution": {
     "iopub.execute_input": "2024-10-29T10:32:12.514768Z",
     "iopub.status.busy": "2024-10-29T10:32:12.514442Z",
     "iopub.status.idle": "2024-10-29T10:32:12.519861Z",
     "shell.execute_reply": "2024-10-29T10:32:12.518997Z"
    },
    "papermill": {
     "duration": 0.036774,
     "end_time": "2024-10-29T10:32:12.521795",
     "exception": false,
     "start_time": "2024-10-29T10:32:12.485021",
     "status": "completed"
    },
    "tags": []
   },
   "outputs": [
    {
     "data": {
      "text/plain": [
       "1159"
      ]
     },
     "execution_count": 47,
     "metadata": {},
     "output_type": "execute_result"
    }
   ],
   "source": [
    "final_input_shape"
   ]
  },
  {
   "cell_type": "code",
   "execution_count": 48,
   "id": "f99b9af6",
   "metadata": {
    "execution": {
     "iopub.execute_input": "2024-10-29T10:32:12.580231Z",
     "iopub.status.busy": "2024-10-29T10:32:12.579936Z",
     "iopub.status.idle": "2024-10-29T10:32:12.588074Z",
     "shell.execute_reply": "2024-10-29T10:32:12.587293Z"
    },
    "papermill": {
     "duration": 0.039657,
     "end_time": "2024-10-29T10:32:12.590010",
     "exception": false,
     "start_time": "2024-10-29T10:32:12.550353",
     "status": "completed"
    },
    "tags": []
   },
   "outputs": [],
   "source": [
    "final_model = compile_model(final_model, optimizer_name=best_params['optimizer'], learning_rate=best_params['learning_rate'])"
   ]
  },
  {
   "cell_type": "code",
 